Team Names,Series Number,Filename,Name,Description,Gender,Attributes,UUID,SHA-256,298,saro-the-clothemaker,saro the clothemaker,The yoruba man that stole the king's wife.,Male,hair: covered; eyes: grey; teeth: white; clothing: red and yellow agbada; accessories: cap; expression: straight face; strength: good-looking; weakness: womanizer,7e10af4e-1252-4f96-83a8-78411e152bae,41f9d96aeb9e3583100291956de762810fc96b56c480ef03168a6c6fe8e43a30
,299,kalu-the-ichie,kalu the ichie,A man of wealth with afluence spreading all over the east,Male,hair: covered; eyes: sky-blue; teeth: white; clothing: orange plain and pattern shirt; accessories: cap; expression: happy; strength: wealth; weakness: pride,482ab247-73a4-4ff8-9172-732f3d0729b8,918112b422218c8fa47cf014ccc6a57af38b33e7ec20f5b2518cf44ca22fe656
,300,tamuno-the-prince,tamuno the prince,An Ijaw prince who is also the heir to the throne,Male,hair: covered; eyes: sky-blue; teeth: closed; clothing: akan;  accessories: cap; expression: straight-face; strength: caring; weakness: easily deceived,108447d1-f2d5-4816-8ebb-599286c3fabf,ea855bc0f37e0a88229014101270c11b4e9542dfbdaecf1c59ca06a45f253691
TEAM SCALE,301,wendy-the -banker,wendy the  banker,"Wendy loves working in the bank, as she gets to meet different people.",Female,hair: dark red; eyes: blue; teeth:none; clothing: blue and yellow ankara; accessories: none; expression: shocked; strength: none; weakness: none ,587645e2-5ace-11ed-9b6a-0242ac120002,f0370da86bd153ce85cb125db0476aca7253a4e48bf3aa5bf6dee295f53f1fc3
,302,uduak-the -dark horse,uduak the dark horse,Uduak looks innocent and has the whole apartment bugged,Female,hair: brown; eyes: blue; teeth:none; clothing: multi-colored ankara; accessories: none; expression: witty; strength: none; weakness: none ,58764862-5ace-11ed-9b6a-0242ac120002,73470147811968f01605907eabaa291a95cdd11083403ab9d852c31a9539904b
,303,timeyin-the -eccentic,timeyin the eccentic,Timeyin is as eccentric as they come with no care for others opinions,Female,hair: brown; eyes: blue; teeth:none; clothing: multi-colored ankara; accessories: smoking pipe; expression: high; strength: none; weakness: none ,58764a2e-5ace-11ed-9b6a-0242ac120002,5d4b7ab0a59a75bf051d6dc097bbd968aadafe0c4d80f7c8b5b1963c64dc480c
,304,omawunmi-the -businesswoman,omawunmi the businesswoman,Omawunmi is a no-nonsense woman with a shop in idumota,Female,hair: pink; eyes: blue; teeth: white teeth; clothing: yellow ankara; accessories: none; expression: angry; strength: none; weakness: none ,58764b78-5ace-11ed-9b6a-0242ac120002,d48b431078d69a93e65b1ac92e49d6aaed118d7445ef621519a2b270dbe72c7c
,305,halima-the-housewife,halima the housewife,Halima loves to bake and cook for her children,Female,hair: brown; eyes: blue; teeth: none; clothing: ankara designed with yellow red and green; accessories: none; expression: tired; strength: none; weakness: none ,58764d8a-5ace-11ed-9b6a-0242ac120002,3ae8a18fd3dbcebc9dbb22586740c50571d6533ec4115ad86289332497a5881f
,306,muna-the -block sister,muna the block sister,Muna loves to tell everyone in the block about her younger escapades,Female,hair: black; eyes: blue; teeth: none; clothing: wolf skin ankara; accessories: headgear; expression: shocked; strength: none; weakness: none ,58764ea2-5ace-11ed-9b6a-0242ac120002,fd4001d7911efb08f66d16de48c9df222ca2ecf7958558dffa744e2781ec00a3
,307,stella-the -gossip,stella the gossip,Nobody gossips on the block like stella when smoking.,Female,hair: red; eyes: covered eyes; teeth: none; clothing: black ankara with bright design; accessories: none; expression: calm; strength: none; weakness: none ,58764fd8-5ace-11ed-9b6a-0242ac120002,579f3609e2f1fd52cfad7444613fedc29f1314bab13679d437184fffffa1cf88
,308,agbani-the-wannabe,agbani the wannabe,Agbani loves to shop antique decorations for her mansion in Idi-Iroko.,Female,hair: purple hair; eyes: covered eyes; teeth: none; clothing: blue one-armed dress; accessories: none; expression: happy; strength: none; weakness: none ,5876542e-5ace-11ed-9b6a-0242ac120002,a623bb9dcd96dcc1f46674decd53f9f39295dd63c57d7697326c966fe65ceb0d
,309,asante-the -warrior,asante the warrior,Asante came from a long line of warriors in Ghana.,Female,hair: pink braids; eyes: covered eyes; teeth: none; clothing: one-armed brightly colored dress; accessories: none; expression: calm; strength: none; weakness: none ,58765578-5ace-11ed-9b6a-0242ac120002,6af1878fbd86de297704735fe9deb8913601ce139cc48a9065b3e6527c945ddc
,310,hilda-the -insomaniac,hilda the insomaniac,Hilda prefers to sleep during the day.,Female,hair: pink; eyes: covered eyes; teeth: none; clothing: multi colored ankara; accessories: none; expression:calm; strength: none; weakness: none,5876569a-5ace-11ed-9b6a-0242ac120002,c26908b7113b317baddae021c4811bff8070f8e8357e39d15242589105168649
,311,sisi yemi-the -street aunty,sisi yemi the street aunty,Sisi Yemi is everyone's favourite street aunty.,Female,hair: dark brown; eyes: brown eyes; teeth: none; clothing: blue and yellow ankara; accessories: none; expression: shocked; strength: none; weakness: none ,587657a8-5ace-11ed-9b6a-0242ac120002,7cd4de4e2bb7244c7f2f1dda8a0ac80fd9b76a480610ecedb0e2fc188ed1e9e9
,312,chiamaka-the -bully,chiamaka the bully,Chiamaka hates people in her business and likes to scare the kids on the block.,Female,hair: pink; eyes: brown; teeth: none; clothing: multi-colored ankara; accessories: smoking pipe; expression: strong; strength: none; weakness: none ,587658ca-5ace-11ed-9b6a-0242ac120002,6e1266ba9ec65ac5d415a1d7bf0daa7025583cd90db672eb8744aab773747e50
,313,gift-the-fashionista,gift the fashionista,Gift has always been bold and that spreads to her fashion sense too.,Female,hair: brown; eyes: brown; teeth :none; clothing: multi-colored ankara; accessories: none; expression: witty; strength: none; weakness: none ,58765adc-5ace-11ed-9b6a-0242ac120002,f77fffd9fdfeb65c13b96ade455820251f6f424dc4a9d3ee1ad40d3597050862
,314,omoyene-the-weirdo,omoyene the weirdo,Omoyene likes to murmur to herself and talks about seeing ghosts.,Female,hair: brown; eyes: brown; teeth: none; clothing: yellow ankara; accessories: none; expression: calm; strength: none; weakness: none ,58765bea-5ace-11ed-9b6a-0242ac120002,d7dc029550c83f395765807dee03e54800e22177c464b2cb8be8b1662cb8a1d2
,315,maria-the -freshface,maria the freshface,Maria likes to believe the world is sunshine and rainbows while blowing gum.,Female,hair: pink; eyes: brown eyes; teeth: white teeth; clothing: yellow green and red ankara; accessories: none; expression: furious; strength: none; weakness: none ,58765d02-5ace-11ed-9b6a-0242ac120002,8854b69865d5d01dc3913176f63cdea6a52703c64a1f5d006fc3ba6a8226cb5a
,316,monica-the -smoker,monica the smoker,Monica is never found without a pipe and loves to interject in every conversation.,Female,hair: grey; eyes: covered eyes; teeth: none; clothing: black ankara with bright designs; accessories: yellow glasses; expression: hip; strength: none; weakness: none ,58765e24-5ace-11ed-9b6a-0242ac120002,c420c5f713eedc8a84664b739670f30a8b908ff3d51ab88be88f0642220fce78
,317,janet -is always -found singing ,janet the singer,Janet is always found singing in whatever activity shes doing.,Female,hair: purple; eyes: covered eyes; teeth: none; clothing: yellow and blue ankara; accessories: yellow glasses; expression: cool; strength: none; weakness: none ,cef902bc-5afc-11ed-9b6a-0242ac120002,f1a4a7c1dbf6002ecef6fb88eb1d9fdb5c4c328cab5c1b81c58784883dff6e99
,318,emi-the-reggae-girl,emi the reggae girl,EMi is a beautiful dancer; she rules the reggae world.,Female,hair:pink braids; eyes: covered eyes; teeth: none; clothing: multicolored ankara; accessories: yellow glasses; expression: happy; strength: none; weakness: none ,cef9060e-5afc-11ed-9b6a-0242ac120002,dcb9fd959bf32a340ee33b34406b26de9af21a7de83bf1dd82f373b392cda3e5
,319,aisha-love-the-life-of-the-party,aisha love the life of the party,Aisha always party during the weekend.,Female,hair: red; eyes: covered eyes; teeth: none; clothing: wolf skin ankara; accessories: yellow glasses; expression: hip; strength: none; weakness: none ,cef907a8-5afc-11ed-9b6a-0242ac120002,9ff6db462caf6ab8623023e02d3c97dc7ec779cf2c72b0ad5c5acb16274f8ef3
,320,amaka-the-tailor,amaka the tailor,She sews the most beautiful dress in the hood.,Female,hair:grey; eyes: covered eyes; teeth: none; clothing: black dress; accessories: yellow glasses; expression: happy; strength: none; weakness: none ,cef9091a-5afc-11ed-9b6a-0242ac120002,e1dc35969dee691bc5932f9837f8a6b29422ead87ba5c3fed4d79894b58947d1
TEAM SANDPAPER,321,omunyinyi-the-stoic,omunyinyi the stoic,omunyinyi wears a Kitenge coat,Male,hair: bald eyes: tearyteeth: noneskin: brownskinclothing: checked ankara accessories: none expression: teary strength: powerful weakness: self-loathing,c2d6a3ac-1d4d-4268-ba7f-4f0f8f50c1ab,9a42a1822cbc56c213cc2fa751e16bf36d9ffeffd9dab92e246121a9904e2dd3
,322,kamau-the-sleeper,kamau the sleeper,closed eyes meditating,Male,hair: blad eyes: closed teeth:  noneskin: brownskin clothing: black ankara accessories: none expression: flat strength: open to suggestion weakness: always sleepy,20330f5c-40c2-4f6a-b9d8-d1d04fb97daf,0c7c6f6a6a8ce72012ce7f51f9cf1100f675b246c95d9a56f7ae7906d8fa4a04
,323,mutiso-the-lastborn,mutiso the lastborn,masked up mutiso dozing off,Male,hair:bald;; eyes: closed teeth: none skin: brownskin clothing: yellow ankara accessories: none  expression: tired strength: consistency weakness: pessismist,0706c338-42eb-4d26-84ea-c24b39628200,40e8777a6ff25df985b606a9079f4a915c5360892758f434af9a497daeb19b33
,324,omondi-the-vegeterian,omondi the vegeterian,omondi wears a green coat,Male,hair:bald; eyes: sharp eyed teeth: none skin: brownskin clothing: green ankara accessories: none expression: alert strength: leader weakness: anxious,bfb5e8d5-d7a7-4aa8-85e8-d7d9afd4adb3,07aae3f135b29a09b178dcd16d1bedc4d3aa87e0ffb8aa65266ab8a6a4c22cd0
,325,barasa-the-optimist,barasa the optimist,looks up to the sky and makes a wish,Male,hair: bald; eyes: blue teeth: none skin: dark skin clothing: brown ankara accessories:none expression: awake strength: strong willed weakness: immoral,2da4bef4-38cc-4414-99ad-7361fac04b2b,cbcc14802a0fd82648042656b608490ee6bbac0e790c581c8e780d6e33ee60e3
,326,mwembu-the-elder,mwembu the elder,"old but not so old, with yellow his favorite color",Male,hair: bald; eyes: black teeth: none skin: dark skin clothing: dark ankara accessories: none  expression: plain strength: fulfilled weakness: angry,36181230-6ac9-417f-af5c-23bdd2c25ecb,2a24d109d912623fd2e39dd82dbdb28b77ea5d9d26fbbccebdd9ba88a098f84a
,327,mbogi-the-fighter,mbogi the fighter,masked up mbogi after capture,Male,hair: bald;eyes:  blackteeth: noneskin: darkskin clothing: onesideankara accessories: noneexpression: willfull strength: fighter  weakness: rebellious,3a7bc3c4-1463-42ce-84c9-07337da64435,a6b306510a42ebf588f6d57c24c6df25bbf243767c53af32a0f791fa9d0117e4
,328,mrosho-the-runner,mrosho the runner,masked up mrosho,Male,hair: bald; eyes: sea blue teeth: none skin: darkskin clothing: purple ankara accessories: none expression: alert  strength: visionary  weakness: destructive,b2ca2c76-3b6d-43f1-8cc9-089b6ab83876,6325c1a07b8ea8301e7e676b761733069c69b52f34100dbcfe90aca3b742bcf4
,329,milele-the-african,milele the african,milele with a nice african print in orange,Male,hair: bald; eyes: blue teeth: none skin: dark skin clothing: orange ankara accessories: none expression: timid strength: leader weakness: failure,644b0259-d75c-456d-934c-ce7c052bad3a,763c04c3880a80aaad62ab55235f4bf66e39c54f35ae8afe95eedc9657cd75de
,330,olebon-the-oloibon,olebon the oloibon,olebon in customized buba sokoto,Male,hair: bald; eyes: closed teeth: none skin: darkskin clothing: animal print accessories: none expression: surprised strength: empathy   weakness: easily bored,de261efe-731d-461e-b2e4-42edd2f48f72,5ff4f03d4a5aa21971fe62e4a7d735e6b53d526b2bc3fd20dd670eea61ddd952
,331,chifu-the-maasai,chifu the maasai,clothing inspired by maasai shuka,Male,hair: bald; eyes: closed teeth: none skin: none clothing: ankara shirt accessories: none expression: visionary strength:  authentic weakness: selfish,239933c4-7177-4b5b-86e8-e6f952301344,b5a992a4afd9b848c14a82852306d5ab7217b42534ef8c804948a1e9641c1a1d
,332,mwangaa-the-voice,mwangaa the voice,mwangaa the chief,Male,hair:  bald; eyes: blue teeth: none skin: darkskin clothing: white lined ankara accessories: none expression: kindness strength:  brave weakness: impatient,49179b62-812d-4d0f-b518-4af7fa79f8bc,e8fc20a8c73e930154dada721e3b77d1b2dccc6c8950b90815e22c830bcac21d
,333,waforte-the-first,waforte the first,masked up man who does sleep a lot,Male,hair: bald; eyes: closedteeth:none skin: darkskin clothing: jean ankara accessories: none expression: shy strength:  weakness: selfish,871912a8-d96e-4594-b7b3-450d94ee6924,4ded707b1dd69078918874f075cdca90c70f39a3a48bb714999ee7c9b73d8687
,334,kariuki-the-prayerful-one,kariuki the prayerful one,kariuki closes his eyes,Male,hair: bald; eyes: closed eyes teeth: skin: clothing: accessories: expression: bored strength: intelligent  weakness: passive,6a5b6fa6-0f91-4b01-957f-c766945eb704,fcdd2a32451354bf38e1d329fb686494cb61ab36c649be5983d475fb91336b5e
,335,kenyanese-the-priest,kenyanese the priest,masked up man with with white cloth,Male,hair: bald; eyes: white teeth: none skin: darkskin clothing: white jean shirt accessories: none expression: calculative strength: kind weakness: takes things personally,0706c338-42eb-4d26-84ea-c24b39628200,02b579786f83bf1e469bfda62327a1c24bdfe5bfd8d289b74ed12e46bc1491f9
,336,nyimbo-the-singer,nyimbo the singer,glasses and a pot for the night,Female,hair:dreadlocks; eyes: glassed up teeth:none skin: brownskin clothing: off shoulder ankara accessories: a pot expression: free spirited strength: fair weakness: impatient,d05af807-b3e9-4ad3-8df1-b7864d2daa33,4189254ffa3661695a3ba2427e9574f753ccb94d5573b8bc07893a32b55e2bac
,337,maathai-the-nobel-winner,maathai the nobel winner,mathaai the warrior,Female,hair: pink afro; eyes: glassed up teeth: none skin: brownskin clothing: colored ankara accessories: noneexpression: strict strength: leadership  weakness:short sighted,0871cb8c-8d56-445d-92c7-01793f327707,15093ce2590b8b84358959c5f59809885526a4ffa9c5498d3dd6c7015a5848d3
,338,tish-the-angry-one,tish the angry one,angry tish with specs on,Female,hair: black huge afro; eyes:  none teeth: broken teeth skin: brownskin clothing: offshoulder ankara accessories: none expression: disgusted strength: blunt weakness:greedy,750a89dc-44ff-43bf-8211-b7776f1b5e52,f23b63c1d1948f40738dc5a8447f243cffb5104ad7e9dfec696d5da1340b0f59
,339,wamenza-the-winner,wamenza the winner,wamenza the leader,Female,hair: laid back; eyes: none teeth: none skin: brownskin clothing: offshoulder ankara accessories: noneexpression: meditative strength: strict weakness: impulsive,7348c9ed-4ac9-4785-9434-0a1f0dcaf8d8,e79e1e8951965752c5a733c14c4a12ac3c8e306613eb989d5f65df7cde7930d4
,340,isaya-the-track-king,isaya the track king,isaya the traveller,Male,hair: none eyes: glassed up teeth: none skin: brown skin clothing: bright ankara accessories: none expression: taken aback strength: straight forward weakness: selfish,41781a16-d2b8-4fc6-a1f4-b9fffc5c95ba,53bced8a3a72d2159b2dfd66175620f2591f58caebdb14b2df863dea84d5a238
TEAM RULER,341,mansur-the-partyrider,mansur the partyrider,Mansur is the life of a party and never caught dulling.,Male,hair: none; eyes: ash grey; teeth: none;  clothing: agbda; accessories: studs; expression:happy; strength: intelligent; weakness: red whine,78db0f29-3936-4d9c-bb90-3dbf20dba2dd,6deb452bd9ae14dbfd1b70e905180f3f58f10c96389ede9fa0be73353703a639
,342,tola-the-businessman,tola the businessman,Tola loves business and owns several shops in Idumota.,Female,hair: none; eyes: midnightblack; teeth: none;  clothing: purple blowse; accessories: mask; expression:furious; strength: powerful; weakness: love,1c5d5a6b-cf04-4bf9-978e-22a7e9bc5819,641dfb249f07ef45936f04997842922fc6f116911dcca4cdae62590f176ae548
,343,abdullahi-the-honorable,abdullahi the honorable,"Popularly called ""buje budanu"" a godfather who lavishes money on young gees.",Male,hair: none; eyes: blue-blackish; teeth: none;  clothing: yoruba attire; accessories: none; expression:anxious; strength: foreseer; weakness:indecision,dd708276-445f-4483-8357-fc08e999328f,f3efdb8fbfae22bc7b918c5c7c02005f25decbbab177d7716d4c999b26ebce7c
,344,ojukwu-the-badguy,ojukwu the badguy,Ojukwu is a business minded guy but fun to be with.,Male,hair: bald; eyes: eagle eyeball; teeth: none;  clothing: yellow lining blowse; accessories: none; expression: none; strength: good eyes for fashion; weakness: lack will power,76c1eabf-15ea-446a-8426-472982c4d800,7b0463deb60c129909faef73077414005a97d11ae7e8b120d24440a5074b4d46
,345,odunsi-the-egbonadugbo,odunsi the egbonadugbo,Odunsi loves to advise and people in the community rely on him.,Male,hair: none; eyes: dark brown; teeth: none; clothing: one shoulder gown; accessories: none; expression: none; strength: elegant; weakness: easily depressed,2912ab8b-5875-4277-a5c2-a0209aee90ae,1bda9e5461ab796347d2c35026cef821c0bd756f378cdabfe1000504d54059bc
,346,ogogo-the-sugardaddy,ogogo the sugardaddy,A rich oil magnate who loves to solve young women's problems with his millions.,Male,hair: none; eyes: cat eyes; teeth: none; clothing: purple danshiki; accessories:nose mask; expression: straight face; strength: brave ; weakness: too selfless,aa575f30-04ad-45f9-a798-199465117793,05277a1eb4f4488e11d684e9435ca9c31c148256d12c977bb1b29c4a47b18cad
,347,suli-the-amalaseller,suli the amalaseller,Suli sells amala with respect and people say that's the secret to her sweet food.,Female,hair: low punk; eyes: cat eyes; teeth: none; clothing:brown babarigai; accessories:none; expression: furious; strength: wealthy; weakness: too emotional,46fd4821-04dd-4f65-9290-c130a00c4c93,d1082c5c6bb7c682ce600c4762c36538996e7b7f6c1f22f669bef00aa76e1413
,348,dolapo-the-afrocentric,dolapo the afrocentric,Dolapo loves African prints and loves to showcase culture.,Female,hair:bald; eyes: brown; teeth: none; clothing: one sided blowse; accessories: nose mask; expression: none; strength: beautiful; weakness: forgetful,cbab232b-5c62-4df8-867b-018a2e496cd4,3105d85bfcbec4f019686f820ed32289b8bd4d8d53fae9d5741d3e19f65322d3
,349,danjuma-the-saddist,danjuma-the-saddist,Danjuma is a grumpy man no one likes to associate with him.,Male,hair: none; eyes: sky blue; teeth: none; clothing:purple agbada; accessories: neck beads; expression: excited; strength: outspoken; weakness: boring,5a42af57-186e-425b-b6b1-f72bda4911ef,97310134bd4c0e9966bcec5c1ea9fadf898823d039f23903e520ea2b3fe99df3
,350,chinedu-the-farmer,chinedu the farmer,A hardworking farmer who has 6 boys who help out on the farm.,Male,hair: none; eyes: black; teeth: brown; clothing: one sided gown; accessories: none; expression: blushy; strength: easily loved; weakness: get angry easily,9e8a55d7-0d8d-465d-a628-08ddd387a2c6,44ea13753538828ff5e2d4255345b0edeb5b24297bde4dfd49550fbf42c12a4f
,351,kola-the-baldguy,kola the baldguy,Kola is every girls dream man because of his hair style.,Male,hair: low cut; eyes: mouse eyes; teeth: none; clothing: gbariye style; accessories: nose mask; expression: unhappy; strength: good eyes for details; weakness: sluggish,c32f1757-da9c-49e8-bd79-510a42b6971a,ee77edb25d7682ef25a033e0ed7cd5362751133b9645f6a826aebbb7a749651d
,352,bola-the-bosslady,bola the bosslady,A lady who supports the boy child by providing scholarship to young talented males.,Female,hair: low cut; eyes: brown; teeth: none; clothing: short orange gown; accessories: nose mask; expression: none; strength: industrious; weaknes:spend lavishly,09ff910d-a2be-49d5-8b27-b9378458701c,71f5d6c471b6430b3bcfe57d2c085836194cb4e107a0d4ccf2449cb6089f2bb8
,353,kunle-the-alienguy,kunle the alienguy,Kunle is special and easily get noticed even in the midst of crowd.,Male,hair: green punk; eyes: green; teeth: none; clothing: purple agbada; accessories: purple beads; expression: unbothered; strength: very energetic; weaknes:eaaily give in,dea2f5d8-e3ba-4d3f-9a17-0a7edfd0c100,17d34b68128a8fd3083c04b1892d0c1ac303594f42bed166f7b76eb4c3c4ed30
,354,segun-the-sharp,segun the sharp,Segun drives with caution and people love him for that.,Male,hair: green punk; eyes: black ; teeth: none; clothing: orange buba; accessories: nose mask; expression: bitchy; strength: team player; weaknes: none,f9159a9c-f48d-4aee-bcc1-63c86209f806,719a33c0e14c42dd80c85dc3b0584324cd233f2eeb38c6e22f07150697199ce3
,355,ola-the-hardguy,ola the hardguy,Ola may be feared but he is such a coolheaded champ.,Male,hair: none; eyes: closed eyes; teeth: none; clothing: purple buba; accessories: none; expression: sick; strength: quick recovery power; weaknes: get ill frequently,a814fc77-bdfa-4e50-8ba8-3e4e4bcfb3c0,9aae9c05d87d08d9a9435c5057f905a54d86b5ff68065adb533b950ca952c675
,356,emeka-the-chief,emeka the chief,Crowd are always at Emeka's house because of his selflessness.,Male,hair: none; eyes: closed eyes; teeth: none; clothing: pakaja attire; accessories: none; expression: bossing; strength: easily comman respect; weaknes: not a ladies man,195e89c8-0b6f-43ad-9a2c-d20f03439e96,0d8389c9d1e8103cabc6afe25b21984cc490b9b16dfb2d5dfb44147af898fc0b
,357,ugochukwu-the-celeb,ugochukwu the celeb,Ugochukwu is an online celebrity with many followers on social media.,Male,hair: white blode; eyes: closed eyes; teeth: closed teeth; clothing: black gown; accessories: gold shades; expression: bitchy; strength: enterprising; weaknes: too emotional,74775cda-cff4-4d21-8819-693127598eca,88817874bf442651e10621b509f2429d11547ad36bc9c5049c1b1ab1e2ee9ccd
,358,adekunle-the-yorubademon,adekunle the yoruba demon,He might be every woman's man but faithful and loyal to one.,Male,hair: gobi cap; eyes: closed eyes; teeth: closed teeth; clothing: ghana dansiki; accessories: gold shades; expression: owanbe mood; strength: from a walthy home; weaknes: disrespectful,5c98c2d8-3144-4e08-8a0f-9b8d7e4f5aa7,33a900ef1e5674fb66315ef2905b4afcdcbee518ba6a6fc0bbf6bf80e9586ef7
,359,favour-the-fashionista,favour the fashionista,Combining dresses is not a problem for Favour.,Female,hair: black ghana weaving; eyes: cat eyes; teeth: none; clothing: senegalese blowse; accessories: gold shades; expression: party rider; strength: smart; weaknes: lazy,19fc15c3-80fe-4d45-a2fe-be8f087d57c4,a401b59001892a030ef7cfb42870ada427efac19fe13b1e5a894ef884476731f
,360,jane-the-slayqueen,jane the slayqueen,Jane is always found in the midst of men and loves partying.,Female,hair: long grey braids; eyes: closed; teeth: black lips; clothing: black short gown; accessories: gold shades; expression: happy; strength:very intelligent; weaknes: have mood swings easily,74775cda-cff4-4d21-8819-693127598eca,37b50b8d085754ce3e6dc1fe9add78a60aade49caa252186f905b008393c68fc
TEAM VBELT,361,osas-the-ceo,osas the ceo,Meet Osas; a Gen-Z CEO with the British accent.,Female,hair: purple dreadlocks;  eyes: none; teeth: none; clothing: danshiki;  accessories: gold glasses; expression: none; strength: none; weakness: none,b10f7e42-4778-49db-820b-dabbad75504a,5097a17166a54c848bf364ba5651549727854118d5d8234e0e5c8ae6395d7cd3
,362,nneka-the-rainbow babe,nneka the rainbow babe,Nneka; the happy rainbow babe with the vibes.,Female,hair: pink;  eyes: none; teeth: none; clothing: blue and black bichrome; accessories: gold glasses; expression: none; strength: none; weakness: none,e7e20ab8-03e0-4e0a-80aa-6e193f84426e,edeef7e80f611c806a698b39afe32cb6cc1f61cbedf007fb75cd57fea879bece
,363,temitope-the-spoilt girl,temitope the spoilt girl,Temitope; our favourite daddy's girl.,Female,hair: none; eyes: none; teeth: vampire teeth; clothing: right one-shoulder wax print; accessories: gold glasses; expression: none; strength: none; weakness: none,10cbcbcb-754e-4175-b85d-d0c7eafa16a2,d70db8cb17892c6b6db597590ad2a51ec8bd1dac7fe2c0661c197ee89ad8b31b
,364,bekeh-the-party animal,bekeh the party animal,Baby Bekeh is life of the party that goes home with your charger.,Female,hair: dark brown;  eyes: none; teeth: none; clothing: left one-shoulder wax print; accessories: gold glasses; expression: none; strength: none; weakness: none,f0558235-3043-46e5-b26c-5bde83cc67fb,0900f8774dca7b8d59e78735ddacf668da4f250dcaa6df9e87b82bc420b91a1b
,365,nana-the-tech lady,nana the tech lady,Nana; the tech madam that doubles as Kumasi Adele in her bathroom every morning.,Female,hair: black; eyes: none; teeth: none; clothing: print kente;  accessories: gold glasses; expression: none; strength: none; weakness: none,e0858913-7050-4c4a-a2a0-442a88463334,54740cf75f7a2733172f472cb9bf90347d82839e55884000e213392275a833c7
,366,rofiat-the-marketer,rofiat the marketer,Rofiat; the distressed marketing intern.,Female,hair: purple dreadlocks; eyes: brown; teeth: none; clothing: danshiki; accessories: none; expression: none; strength: none; weakness: none,1e4d9bda-f6f9-4e7a-9381-bee4b074b56d,a08b66ecb8536952bc7a62d6b420193dc45497597dba56250ed8c478e4590118
,367,zarifa-the-righteous,zarifa the righteous,Meet Zarifa; a proper baddie for Christ.,Female,hair: pink; eyes: blue; teeth: none; clothing: v-neck original kente; accessories: none;  expression: none; strength: none; weakness: none,c6955d16-c343-46bc-9bed-c069ea8cc65a,50a63914f7ee611b21c52a136a2c7037dba6bcf45ca66ee351fb29a34111afbb
,368,modinat-the-troublesome,modinat the troublesome,Modinat; The queen of gbas gbos.,Female,hair: long maroon hair; eye: none; teeth: vampire teeth; clothing: right one-shoulder wax print; accessories: brown glasses; expression: none; strength: none; weakness: none,49eb44e8-1117-463b-b7b3-1bcea4258362,7804cea715edfa1988a412bc18fce4094dab87e1deea675455c68ffc3965d527
