Team Names,Series Number,Filename,Name,Description,Gender,Attributes,UUID,SHA-256,76,avatar-aang,avatar aang,A man who is ready to save the world.,Male,hair: bald; eyes: opened; teeth: none; clothing: kaftan; accessories: nose mask; expression: soothing; strength: mind games; weakness: insomia,169f93a0-59d2-11ed-9b6a-0242ac120002,3b7be56a1fbb1e4b40536db8bd555f2fb3a7ac5fc6b3ff3ec13e70009cccf062
,77,argus-greek,argus greek,A man who you will always find on the look out.,Male,hair: bald; eyes: opened; teeth: none; clothing: overall; accessories: nose mask; expression: suspicious; strength: strong;  weakness: lateness,e7f26b26-59d2-11ed-9b6a-0242ac120002,1e755490dd61593824589f0f87704b0b34b483f8ac69efe8c666879ec2da89d3
,78,amahle-of-zulu,amahle of zulu,A traditional man; feeling fulfilled.,Male,hair: bald; eyes: closed; teeth: none; clothing: ankara print; accessories: nose mask; expression: excited; strength: conversationist; weakness: traditionalist,169f93a0-59d2-11ed-9b6a-0242ac120002,d66f1d505219e985d5b307c5023cdfb09bcf6c409f6db98dd3007b974ca036f1
,79,agnar-ole,agnar ole,A man who feels like an outcast and always has a battle with his mind.,Male,hair: bald; eyes: opened; teeth: none; clothing: overall; accessories: nose mask; expression: furious; strength: strong willed; weakness: crying,f3f11fd0-59d2-11ed-9b6a-0242ac120002,88043297224e90c9623ab812b76505e235c2bd977a248af13a3a3870c9f68caa
,80,adom-kulu,adom kulu,A ghanaian model; proud of his culture.,Male,hair: bald; eyes: opened; teeth: none; clothing: kente; accessories: nose mask; expression: irritated;  strength: height;  weakness: pride,00f6589e-59d3-11ed-9b6a-0242ac120002,219e9be6ad6fe2be5b6c0fd21cca9bae25c15854ed03dc160cb5de0bea606e4b
TEAM PRYBAR,81,segun-baller,segun baller,A man who loves to have fun.,Male,hair: black; eyes: black; teeth: none; clothing: kente; accessories: glasses; expression: cool; strength: jovial; weakness: nonchalant,58ac5cf6-b644-41c6-af79-ec9aa5f6bdd1,370a7ee01fafa6eed1ccb0c1be6471238c9d712b156d15e8d0256fe392a384e9
,82,bolanle-pepper-dem,bolanle pepper dem,A lady that loves to show off.,Male,hair: bald; eyes: back; teeth: none; clothing: kente; accessories: glasses; expression: proud; strength: strong; weakness: big spender,46966104-775b-4443-90bb-b35afd121653,9b6fd5315c56dd4b340ab2ce377d783f39b1b82efc24061fa48c7d0977e84712
,83,tayo-tailor,tayo tailor,A professional fashion designer.,Male,hair: black; eyes: black; teeth: none; clothing: orange shirt; accessories: glasses; expression: inquisitive; strength: creativity; weakness: opinionated,70828783-ac38-48cf-b966-cfebc92ebd86,f7185652418af3c4c98bd216fdd5bc4262b2521fbd71c7785839ebe614b246de
,84,ajasco-comedian,ajasco comedian,A newbie comedian.,Male,hair: black; eyes: black; teeth: none; clothing: green shirt; accessories: glasses; expression: bold; strength: optimistic; weakness: unobservant,8bebdb3a-f0a8-47ba-892f-39aa275fbd0d,4f175050f0fe585f1d85e092881be3b2c824f7dedd4abdbe5b238bc8f2c71c12
,85,tobi-babyboy,tobi babyboy,A guy who does not like stress.,Male,hair: black; eyes: black; teeth: none; clothing: white shirt; accessories: glasses; expression: friendly; strength: outgoing; weakness: lacks boundaries,3da592d4-5dec-4bc5-8412-f1b2a0269f95,f3f4125e02c7ba892b020ced1b216cd341564822690bb009c362a60a325bfc51
,86,esther-sassy,esther sassy,A rude lady.,Female,hair: brown; eyes: grey; teeth: none; clothing: animal print; accessories: necklace & earrings; expression: bold; strength: confident; weakness: judgemental,0642a25a-966d-446f-b021-a6d18e7fa0c5,1ae64a01fabfcd2e95b57f4347ca4ce66291545d8e36baf9c5c72d3b1314b48c
,87,ozo-fineboi,ozo fineboi,A charming person.,Female,hair: brown; eyes: blue; teeth: none; clothing: aztec print blouse;  accessories: choker & hookah; expression: blank; strength: charismatic; weakness: proud,f2286b4d-fae6-48cb-a686-badec16da1d8,1b3ecdd247662742bd12099e78da42fb8b21e2a36b5e17f925f8b1b4aaaf61e9
,88,ade-party-girl,ade party girl,The life of every party.,Female,hair: brown; eyes: blue; teeth: gap-tooth; clothing: one-sleeved blue top; accessories: none; expression: scary; strength: adventurous; weakness: impulsive,7e3db30c-9faf-430d-ab48-b854fe0456b9,eab8ac0a877a2499382d6d64b7d6d28b2acb13b528640034ab2c93eefcfe704d
,89,john-casco,john casco,A very observant person.,Female,hair: black; eyes: blue; teeth: none  clothing: one-sleeved ankara top; accessories: earrings & necklace  expression: shocked; strength: unpredictable; weakness: loner,2eff88ef-5bc2-4779-917a-533e952e2953,6e459953bba03a2bff5256004e7879535b0a61c6dd35f8f2720d5a89fbec8572
,90,agha-uwa,agha uwa,A woman of high social class.,Female,hair: brown; eyes: blue; teeth: none; clothing: ankara top with strap & full sleeve; accessories: earrings; expression: sad; strength: daring; weakness: loner,8478a002-1eba-4a05-8b98-7170c6e39254,4d94e29e91403e9ac8111d979cfd2160f1ff845ba4e711f3ec5d9b48eacf94c9
,91,udeme-great,udeme great,A lady given to adventures.,Female,hair: purple; eyes: black; teeth: none  clothing: ankara top with blue sleeves; accessories: green necklace & green earrings  expression: clueless; strength: decisive; weakness: stubborn,d1476409-6f8b-4be9-8c93-24d9123749c5,b21cdd4ad38035df1d92d502ad5313f303a5363a1a361146233cda7f3d74e84d
,92,femi-tech-bro,femi tech bro,A rookie in the tech industry.,Female,hair: brown; eyes: black; teeth: none; clothing: ankara top with blue suspenders; accessories: green necklace; expression: mischievous; strength: creativity; weakness: procastination,ba3ec22a-13d5-4e19-9b7f-aac764fda28c,980f4b5495ef35cf577190ff5dcf2cebed14701f1196597e776e6efc013c5ea7
,93,sai-baba,sai baba,A leader of a third-world country.,Female,hair: brown; eyes: black; teeth: none; clothing: off-shoulder ankara top; accessories: earrings & necklace; expression: anxious; strength: trend spotter; weakness: distracted easily,fdfff369-5b57-4612-9f89-f5d408f24a35,7380d376ef528b7e2e156b1a2fcb7a16470667d91e43178139b8c52cb4b63919
,94,omo-pastor,omo pastor,A devout christian.,Female,hair: brown; eyes: black; teeth: none; clothing: spaghetti strap ankara top; accessories: green earrings & green necklace; expression: happy; strength: happiness; weakness: too emotional,49e09559-61a6-41ff-811a-272721a7475c,3b2775febb99769b56308fe66976ee87b41132410e4b060864abd441fa539e70
,95,obi-container,obi container,A rich south-easterner.,Female,hair: brown; eyes: black; teeth: none; clothing: animal print top; accessories: green necklace; expression: surprised; strength: wealthy; weakness: risk taker,4b64cf48-94fa-4aed-8cf2-452974b48ee3,cac5564e748eecc142793ea3f8a9d998be9878deeab641ed1f8a8749ce0f4b99
,96,erigga-international,erigga international,Superstar from South-South.,Female,hair: brown; eyes: black; teeth: none; clothing: half ankara; accessories: green necklace & red scrunchie; expression: curious; strength: talented; weakness: overconfident,3ac39a5e-7b0c-4371-b0c8-7cb4b68aed2c,c34ae929f79a93ab0863649db79382644e05db9295d13e47cbaa269d88354999
,97,ayo-web3-bro,ayo web3 bro,Someone with no actual knowledge of basic computer principles.,Female,hair: brown; eyes: blue; teeth: gap tooth; clothing: sleeveless ankara top; accessories: green necklace; expression: terrified; strength: tolerant; weakness: illiterate,c137ec2b-18cd-4c29-a194-af29ac9e6c1c,63bb05147efe1132cdbef06a819e234afb43254a73e22f356a859216d56433cc
,98,phoebe-queen-bee,phoebe queen bee,A self-centred woman.,Female,hair: brown flowing hair; eyes: blue; teeth: none; clothing: ankara top; accessories: none; expression: blank; strength: attractive; weakness: gullible,1277e9c0-81dc-4747-89df-a9d2ae4fcf96,913d868ee26f22f478bcb57c6e6817c70df6f396e3a7c81295697e4b316ba692
,99,rachel-warri-babe,rachel warri babe,A highly disciplined woman.,Female,hair: red braids; eyes: white; teeth: none; clothing: yellow danshiki; accessories: none; expression: blank; strength: assertive; weakness: talkative,19e6af3b-ef2d-46ba-ba05-59fb612ebbee,4926e39c5d7fc64eb2078f47a462e0e089e0368e02f8675635d741366a4b8a0a
,100,adun-preacher,adun preacher,A religious woman.,Female,hair: black short hair; eyes: blue; teeth: none; clothing: blue paisley print blouse; accessories: ankara bonnet & hookah;  expression: blank; strength: bold; weakness: fake,cc4dfedf-c343-48db-ad67-e39452ec2380,26a16be7aa59c27eaf0a4aa8928db48630c67248910f8a214ef73bcfe72769a3
TEAM CHISEL,101,adebola-omo-oba,adebola omo oba,Adebola loves soft life with her fathers wealth.,Female,hair: brown; eyes: opened; teeth: white; clothing: ankara print; accessories:none; expression: staring; strength: bold and outspoken; weakness: pride,fbf43611-f267-4cba-bf4b-a3ffdc122589,d802c5d527f4c963ecb466f01e58cf3d177bd031b19adbacc45a666bff064158
,102,chichi-the-dancer,chichi the dancer,Chichi loves dancing and party.,Female,hair: black; eyes: blue-opened; teeth: none; clothing: ankara print; accessories: none; expression: shocked; strength: dancing; weakness: lovergirl,e7c32b06-7022-49b4-bbe5-81e8c1d58583,fafd991b925eda9b85f0aa199893f72a784b56aa2b8d0a9bf5579dc7d86fc7b6
,103,hammed-the-farmer,hammed the farmer,Hammed owns a farm with his family.,Male,hair: none; eyes: opened; teeth: none; clothing: brown and cream buba; accessories: nose mask; expression: innocent; strength: farming; weakness: drinking,e57d8985-599e-49da-8d62-fc16b7ac93f2,d94a940d174f407709f21683d50a1e9c52e8607f16808d71c1f7f9ed94e8c200
,104,farida-the-tivlady,farida the tivlady,Farida is a beautiful Tiv woman.,Female,hair: brown; eyes: opened; teeth: none; clothing: ankara print; accessories: lipgloss; expression: cool; strength: cooking; weakness: multitasking,31d3e229-003e-43c8-ba82-38f49cf58ccb,acd4d6e14e38469e5ef9ca0417201fe29c8d5773b79ffab3d6d880ce9f147df2
,105,hannah-the-singer,hannah the singer,Hannah loves singing and belongs to choir.,Female,hair: blonde; eyes: opened; teeth: none; clothing: flower print dress; accessories: earrings; expression: angry; strength: singing; weakness: reading,281f5bd7-5282-458b-9811-e369980e7dee,2e07f9e0b8a30fe021d9b2c1f2bc1a702102ad47332e3b280a190fa7ae27c3a3
,106,nonso-the-igbogirl,nonso the igbogirl,Nonso is a hardworking Igbo girl.,Female,hair: black; eyes: opened; teeth: none; clothing: leopard print blouse; accessories: none; expression: happy; strength: business; weakness: spending,5cfa76df-8376-4505-af12-78af24f108d6,de8bdabcc69fd5d72462d05d2bc5fa2b792240c8f4445f627721600a3456669a
,107,shade-olori,shade olori,Shade loves soft life and makeup.,Female,hair: black; eyes: blue-opened; teeth: none; clothing: ankara print; accessories: none; expression: none; strength: makeup; weakness: sleeping,1a07ca73-d39b-43e9-a0f1-ef9f5e57d3a9,32d3c3108eca2eb36d35f583489f1c95c311b9677dbb585eeaadf17861df437e
,108,quadri-the-teacher,quadri the teacher,Quadri is a devoted teacher that teaches mathematics.,Male,hair: none; eyes: opened; teeth: none; clothing: yellow on blue jean; accessories: nose mask; expression: none; strength: teaching; weakness: talking,d96a93e7-17a4-4efe-b09b-02185cc81ce8,3d9d32e829375c90fee7ab360a283878a037c67c854bd981b974768de24a18ed
,109,Ifeanyi-the-dj,Ifeanyi the dj,Ifeanyi is a music dj that performs at events.,Male,hair: none; eyes: opened; teeth: opened; clothing: animal print; accessories: red cap; expression: none; strength: mixing songs; weakness: none,030f665d-2cd7-4376-aef5-4030dad9f2d6,fd9a7cedfc7b28b5e40d7007ca09ea162dedee47aa0e0e9645c537927112630d
,110,fayo-the-yorubademon,fayo the yorubademon,Fayo is a yoruba demon with excellent communication skills.,Male,hair: bald; eyes: opened; teeth: none; clothing: africa print; accessories: mask; expression: none; strength: determined; weakness: steals,e270e278-a9b5-408d-b527-d518239a997b,1e2eeb0082bb3b3038cba42fc07ace421fe6d3a5bdc1f073380e381da581ce11
,111,nkechi-the-actress,nkechi the actress,Nkechi is an international actress that acts in hollywood.,Female,hair: purpule short hair; eyes: opened; teeth: none; clothing: native print; accessories: smoking; expression: rugged; strength: love; weakness: lie,34b1136d-00b1-4f29-8a03-5b02291d47d5,98d476d630ec0e5f2dc0af7dc1096853374c3f819cb881b4bb20042d47564d2d
,112,hamzat-the-mallam,hamzat the mallam,Hamsat is a mallam doing burea de change for a living.,Male,hair: bald; eyes: opened; teeth: none; clothing: wrapper; accessories: none; expression: straight; strength: traditional; weakness: diabolic,592eff9f-93b2-4452-a2ed-5d44ebc969db,9773dcf70cf15e49e2b1ef4eeec3d39e4d92ba37ab8614a6efc0b5016202f119
,113,nnena-pretty-girl,nnena pretty girl,Nnena is beautiful girl that loves to talk about her beauty.,Female,hair: brown bob marley; eyes: open; teeth: covered; clothing: african print; accessories: sucker; expression: none; strength: giver; weakness: possesive,d9477612-ad63-408e-8d12-24679c647b32,ed57d4250419b56df607825eca9bad5432e2760fc81a7244380d094a545ec144
,114,tunde-the-boss,tunde the boss,Tunde is a boss that loves to take charge at work.,Male,hair: capped; eyes: opened; teeth: white; clothing: native cloth; accessories: none; expression: none; strength: cooks well; weakness: bossy,7635c4ee-04f6-4872-bfc9-37e5a73c8fc6,81136a07ca6f1f6b32bbf1543e1ea3a59baf6c472ad219fef10db23b137a5842
,115,nnamdi-the-barber,nnamdi the barber,Nnamdi is a barber that devotes time to perfect his craft.,Male,hair: brown afro; eyes: open; teeth: smokey; clothing: africa print; accessories: none; expression: none; strength: determined; weakness: loves clubbing,152758f3-9414-45a2-a809-95cb05a3de13,8c051e9c059c4a7d9df1232509ebc71bc3b828a1eddc7e02db693c46621b3a20
,116,amaka-the-hypepriestess,amaka the hypepriestess,Amaka is can never be intimidated no matter the circumstance. ,Female,hair: black hair; eyes: opened; teeth: open teeth; clothing: africa print; accessories: none; expression: laughing; strength: independent; weakness: insultive,c7726e84-3c5c-4e66-8677-cbfb5c9ee850,8410595ea43df3dfac45186cbda8f70c5a9e7a96c33f7994bda5f84f45dc3687
,117,kemi-foodie,kemi foodie,Kemi loves food and can also prepare good meals. ,Female,hair: black har with scarf; eyes: partly opened; teeth: none; clothing: one hand style; accessories: none; expression: none; strength: can cook very well; weakness: dirtiness,3116cb6f-14c4-4d5a-af57-54253b72a309,81cee45e096679be10aa6054267103e0b0b8f96a578cf921d925035ee36c9651
,118,ada-the-fashionister,ada the fashionister,Ada loves fashion that she rarely repeats cloths.,Female,hair: brown afro; eyes: glasses; teeth: white; clothing: africa print; accessories: none; expression: smiling; strength: successful; weakness: too serious,a14df1c1-7a5a-4a33-8780-0fb01c593da6,89e21346749d167846d571d447e40dd08ca835657ef8687dbb650d2b7bbd3eba
,119,kayode-the-baller,kayode the baller,Kayode loves life and lives it.,Male,hair: bald; eyes: wide opened; teeth: none; clothing: yellow on jeans; accessories: none; expression: none; strength: swaggy; weakness: loves women,fe17bfdc-c251-4654-8313-1ab793e11748,6a3a0bc5482309c6c1de92fd980f050878b924991b2aff52ad408f4a4d9f3bbc
,120,kola-of-lagos,kola of lagos,Kola is the life of the party everywhere he is.,Male,hair: bald; eyes: opened; teeth: none; clothing: native; accessories: none; expression: none; strength: intelligent; weakness: shy,df295be1-1509-406e-a263-28a5dee0abca,09e58b9787d93f162454041e35647b05897c6b33514b0a234b324d6ce00458b6
TEAM BRAINBOX,121,azikiwe-popular-trader,azikiwe popular trader,Azikiwe is a popular trader.,Male,hair: none; eyes: blue; teeth: none; clothing: purple and yellow; accessories: cap; expression: happy; strength:strong; weakness: shy,7ebde325-8efc-4997-811a-b5686269929e,ad303f7e11e73a572963eb5cf0872774ac39e4eec6c920b21ef6ba302e8880c8
,122,obasanjo-funny-guy,obasanjo funny guy,Obasanjo is such a sweet guy loves by all. ,Male,hair:none ;eyes: black; teeth:small open teeth; clothing: sleeveless yellow ankara; accessories:none; expression: serious face; strength:mild; weakness:anger,c136a120-a339-4080-96ca-1c93845c5848,9f416fed289c670b642c26511925b532d8051b1b1c8e086640d3a89e01a1384e
,123,yakubu-village-chief,yakubu village chief,Yakubu is the best village chieftain.,Male,hair:none ;eyes: blue; teeth:open white teeth; clothing: black isiagu; accessories:cap; expression:happy; strength:strong; weakness:impatience,5b0c0d26-d204-4264-b579-081ff9df935b,c3e080e0d70467a4ed215bc477e0dd3a20953244014c1b88bcfc02c1fb151b80
,124,abacha-loves-smoking,abacha loves smoking,Abacha loves taking cigarettes.,Male,hair:cute braided hair ;eyes: black ball white eye; teeth:none; clothing: mixed colors ankara wear; accessories:none; expression:happy;  strength:strong;  weakness: anger,8ac6d95f-0cf3-4f54-9cf2-be8834b3004c,b487afd9327d5b1d92384bc980a1bf073866f8f3c6fde743938b1a9c6018fa30
,125,johnathan-good-leader,johnathan the humanitarian ,Johnathan is very progressive young man.,Male,hair:punk bearded man ;eyes: closed; teeth:none; clothing: white shirt and senator; accessories:cap; expression:bone face; strength:strong; weakness:pride,241e3713-4ce3-48d0-827f-b282ae2db6c4,18116a1f6bede6dc88f1fee0abbd58314c3241bf8f774642f87879c09daed6a0
,126,johnathan-genz-kid,johnathan genz kid,Johnathan is zealous young man.,Male,hair:none ;eyes: blue;teeth: white; clothing: yellow ankara wear; accessories: traditional cap; expression:happy; strength:strong; weakness:arrogance,90c0ae09-a35f-42ad-b93c-dcf30169acd9,9b5768ff0dc5dc1550ed554c801703711153a3bb35bb254e5afe796e308e7378
,127,eddy-the-community,eddy the community leader,Eddy has so much positive energy.,Male,hair:none ;eyes: blue; teeth:none; clothing: black isiagu wear; accessories: cap; expression: happy; strength: strong; weakness:emotional,5cabf9d9-882b-459e-9253-8c07eb045e2d,a1859e4db8734b7a92ce4727b06b5e64a54ebcf5c0e973e5c53f551fde57ffbb
,128,olu-the-oba,olu the oba,Olu the great ruler in our land.,Male,hair: purple braided hair ;eyes: black; teeth: none; clothing: mixed color traditional wear; accessories: none; expression: serious face; strength:mild; weakness:anger,04c4b28a-aca0-44b1-a064-ed0d9d2a31ca,f8d8dc89911aeda1b04b83001e42daabec0d8fa8fe163e22b2d785618da2fc32
,129,edu-the-biggest-trader,edu the biggest trader,Edu is the biggest merchant in west coast.,Male,hair:none ;eyes: blue; teeth:closed; clothing: black and yellow collar native wear; accessories:cap; expression:happy; strength:strong; weakness:impatience,48d1de5f-5f3f-46aa-b2fd-68420a8e802b,00c13c235939bf39d6afb53b3652b455df8aaebd36858f584a49af4d81a8c8a7
,130,james-importer-and-exporter,james importer and exporter,James is the sole importer and exporter of spare parts.,Male,hair:none ;eyes: blue; teeth:none; clothing: purple and yellow; accessories:cap; expression:happy; strength:strong; weakness:pride,22541251-022f-480c-8c1e-cf754dce16d6,9d7fdf049549e26d9fec73879c4977e198be6e3deedc2a7d1a8b62650eaac0df
,131,lanre-the-dreaded-guy,lanre the dreaded guy,Lanre has a great reputation.,Male,hair: none ;eyes: none; teeth:white; clothing: ankara; accessories:cap; expression: happy; strength:strong; weakness:anger,66a054cd-5541-4000-98aa-8f2e9892d880,8c62e1ea440e98a322f2e89a6f9b68ba86d0abf31a0884040896671603e66556
,132,olamide-the-street-boy,olamide the street boy,Olamide has a sweet voice.,Male,hair:none ;eyes: white; teeth: none; clothing: green and blue; accessories: cap; expression: serious face; strength:strong; weakness:stubborn,d50a35b1-b42e-4e0c-8dd8-9b892b56d371,1e6116618514716734d9398f8ac49aaa21f3b00c1ba454a5ea54e6cdc2b98f0c
,133,uche-peace-loving-man,uche peace loving man,Uche man of peace and discipline.,Male,hair: yellow ;eyes: blue;teeth:none; clothing: yellow; accessories:none; expression:happy; strength:strong; weakness:emotional,6c9d6eae-2ea2-468c-a2c8-928aaafc084b,5adbed547d8b70397c5184855ccd0743f2c0d9aea5b97ab37a34d7df572901d7
,134,dave-the-tech-bro,dave the tech bro,Dave is a web3 enthusiast.,Male,hair: none ;eyes: none; teeth:white; clothing: none; accessories:cap; expression: serious face; strength:strong; weakness:none,c0857b11-bf0e-46a4-9108-b8eb93d83e74,af77380e1ae7cf5a72ea9dcad471376cd6bdd4fbeb7d5000be2dcec580458086
,135,obi-the-biggest-humanitarian,obi the biggest humanitarian,Obi loves service to humanity.,Male,hair:none ;eyes: blue; teeth:white; clothing: brown; accessories:cap; expression:happy; strength: strong; weakness:none,201a408c-7a2e-42d9-a62c-0136c885c211,75f292bba92cfbedbb0ec3b9f9deea14050f7c840cd520e7654e7f27f5dbb5e2
,136,precious-the-emotional-girl,precious the emotional girl,Precious is soft hearted and sensitive.,Female,hair:none ;eyes: white; teeth: white; clothing: yellow and blue; accessories:cap; expression:angry; strength:strong; weakness:none,b6a41ff1-51ce-42f7-9933-85d0a22ced68,fab21337da8a06e7829c030e5bb5ab8d225cc44a9552e73e62e995e13ec5cfb7
,137,ella-serious-minded,ella serious minded,Ella a dedicated young lady.,Female,hair: none ;eyes: white;teeth: white; clothing: black and yellow; accessories:cap; expression:happy; strength:strong; weakness:none,04036447-f43e-4bfb-9503-f55c9064b14e,e3c9947e9819e2cde2fe96fa78e35f59f241a822a78247c2cee0af4aa3d8df91
,138,cynthia-cute-eyes,cynthia cute eyes,Cynthia with priceless cute eyes.,Female,hair:yellow ;eyes: blue;teeth:none; clothing: blue and yellow; accessories: none; expression: serious face; strength: mild; weakness:pride,5d12847b-6d71-4691-8337-2e6ef3e283b2,ab1037533c0ab1e14da730bd8d60ae7bf29ffa02b71e351425f2dd62096ae7d5
,139,mary-with-hair,mary with hair,Mary with her beautiful Afro.,Female,hair: none;eyes: none;teeth:none; clothing: casual ankara; accessories:cap; expression:scared; strength:sensitive; weakness: fearful,98035e8b-6540-4464-8a3c-fdac9f07b168,64556d0a8180ca9a790338389710817112c655a5a0785d72537e4cd8d8263e23
,140,ada-chewing-bubble-gum,ada chewing bubble gum,Ada always chewing gum.,Female,hair: none;eyes: none;teeth: white; clothing: traditional wear; accessories:cap; expression:sassy; strength:decisive; weakness: insensitive,15309dc5-e483-4658-b503-db85ba2c1722,504bc85e3e6919bdf61a57506057be75cca4a8b32a7937766e26135af52d6b7a
TEAM PLUG,141,viganem-the-drummer-girl,viganem the drummer girl,She is known for typically playing the drum for 5 hours per day without a break.,Female,hair: none; eyes: none; teeth: none; clothing: ankara with drum patterns; accessories: none; expression: sumg; strength: none; weakness: none,5a5a6f5c-39f3-4beb-ab74-60d3c7a90fd4,fd5975079704e00dccef80a166d526058ae2b962388d3d8b0ad6a27b3e51c4ba
,142,lenusuka-the-big-woman,lenusuka the big woman,The lady that loves spending money and buying everybody asaobi.,Female,hair: purple; eyes: none; teeth: none; clothing: black and blue ankara; accessories: none; expression: serious; strength: none; weakness: none,e564a43a-ef77-487d-a88e-749d20a09fd8,fdc5835ade509316697ee85589556c4dbbc5c92814e37c4cf7181ca32c020463
,143,enepua-the-clout-queen,enepua the clout queen,The lady that travels all day and enjoys snapping food at restaurants.,Female,hair: purple; eyes: none; teeth: none; clothing: black ankara with yellow and blue gear pattern; accessories: none; expression: chill; strength: none; weakness: none,6dc7e452-0626-4f4c-a28c-f5db3532e305,dbe2b808601af2f26d9a19fc2d464df370b6778342568ade9600c81382c3383b
,144,usifong-queen-of-mushin,usifong queen of mushin,Changes her hair every 2 weeks and cannot finish one pure water.,Female,hair: brown afro; eyes: none; teeth: none; clothing: black ankara with yellow peach and blue gear pattern; accessories: none; expression: unbothered; strength: none; weakness: none,221263d0-8775-49f8-bbf8-4b08b49e1482,4e6490180dc8a4724af3f709b3d61db25980941b2938ef8c9817e77f35a69c98
,145,akinyim-the-clown,akinyim the clown,"The most interesting christmas clown, known for dancing in prisons and hospitals on christmas eve.",Female,hair: burgundy dreadlocks; eyes: none; teeth: none; clothing: kente blouse with asymmetric neckline; accessories: none; expression: off-standish; strength: none; weakness: none,c1070dce-48a1-4ae8-b9a4-d070859a8377,9fa26b465f4df38e17f550e511f20bf4d7e938f7522a4fba12e153bcdc06e5a4
,146,zawadi-mr-sleep-everywhere,zawadi mr sleep everywhere,Likes sleeping in the weirdest places especially in clubs.,Male,hair: brown; eyes: none; teeth: none; clothing: kente agbada; accessories: none; expression: goofy; strength: none; weakness: none,c22489fe-574b-47f3-9667-c9c798b2d4df,7cb2a431b660f243aa1ac56772850b9f0830b9fc5f505419d8edff14be892f28
,147,chepkirui-mr-self-love,chepkirui mr self love,Likes taking care of himself and spending on himself.,Male,hair: burgundy; eyes: none; teeth: none; clothing: black and kente patterned agbada; accessories: none; expression: sleepy; strength: none; weakness:none,1a91e778-d214-476b-a667-94e9ecb8b5ce,13da30b20e4e341c56626b61ad53cf3328c180f6c70b8ff0016eb90093d6ed99
,148,naserian-the-fear-fear-dancer,naserian the fear fear dancer,A timid and dancer who is always afraid of a large crowd of audience and yet his dance moves can raise the dead.,Male,hair: face; eyes: none; teeth: none; clothing: yellow and blue ankara; accessories: none; expression: warm; strength: none; weakness: none,8177cf38-8284-4eb4-b19c-04473bcb3b5e,1ab140aa44138a3946e796c8b4201b98fc3eac5e3ef34cfffb8268859bd61399
,149,wawuda-the-ashawo-of-africa,wawuda the ashawo of africa,Brags about his body count and follows skirt anywhere.,Male,hair: blue; eyes: none; teeth: none; clothing: green top with blue overalls; accessories: none; expression: fear; strength: none; weakness: none,0554bf35-f588-4009-aafc-ef875b878c29,3bef2d78481bf716b2ae487a0404a249e4a24b7393f42c514287484d9c9192ca
,150,kerubo-the-igbo-smoker,kerubo the igbo smoker,Loves only his igbo and is happy when he finds an old blunt.,Male,hair: brown; eyes: none; teeth: none; clothing: brown shirt with dog pattern; accessories: none; expression: smirking strength: none; weakness: none,33ba8e73-7949-4bc7-ba27-37ee1d573946,acd2aeb6f106b36a5646cba457d6eb1e013dc48cb29249a17c0429bf6c35af86
